{
  "event_id": "406dcd6d-4072-5f7f-96cd-12378a3ec437",
  "event_type": "feasibility.ephemeris.computed.v1",
  "schema_version": "1.0.0",
  "occurred_at": "2026-08-07T10:37:14Z",
  "correlation_id": "6d618e61-404e-58d2-a0e6-4360ee2e7e75",
  "causation_id": null,
  "producer": "feasibility-service",
  "data": {
    "satellite_id": "SENTINEL-1A",
    "computed_at": "2026-08-07T10:37:14Z",
    "horizon": {
      "start": "2026-08-07T09:00:00Z",
      "end": "2026-08-07T09:02:00Z"
    },
    "tle_reference": {
      "satellite_id": "SENTINEL-1A",
      "norad_id": 39634,
      "tle_epoch": "2026-08-05T22:40:01.440Z",
      "tle_age_hours": 35.953488675555555,
      "staleness": "AGING"
    },
    "epoch": "2026-08-07T09:00:00Z",
    "sample_interval_s": 10.0,
    "sample_count": 12,
    "samples": [
      [
        0.0,
        144.57419750151485,
        -48.72472218128008,
        715008.2923677843
      ],
      [
        10.0,
        144.33820200154932,
        -48.13251125612314,
        714760.9142765095
      ],
      [
        20.0,
        144.10661173325394,
        -47.53989390111113,
        714512.3145154892
      ],
      [
        30.0,
        143.87924141777907,
        -46.94688331573466,
        714262.5839884349
      ],
      [
        40.0,
        143.65591541648277,
        -46.35349201903054,
        714011.8139117503
      ],
      [
        50.0,
        143.43646710885164,
        -45.75973189685199,
        713760.0957764174
      ],
      [
        60.0,
        143.22073831708224,
        -45.16561424553217,
        713507.5213096882
      ],
      [
        70.0,
        143.00857877335878,
        -44.571149812166226,
        713254.1824366222
      ],
      [
        80.0,
        142.79984562618392,
        -43.97634883194393,
        713000.1712415414
      ],
      [
        90.0,
        142.59440298251684,
        -43.38122106262869,
        712745.579929341
      ],
      [
        100.0,
        142.39212148277213,
        -42.78577581657051,
        712490.5007867343
      ],
      [
        110.0,
        142.19287790593108,
        -42.190021990317774,
        712235.0261433875
      ]
    ]
  }
}
